{
  "schemaVersion": "ruleoak.governance.v1",
  "recordType": "RunRecord",
  "runId": "py-run-001",
  "domain": "generic-python",
  "workflow": "governed-tool-call",
  "actor": "python-local-user",
  "status": "completed",
  "createdAt": "2026-01-01T00:00:00.000Z",
  "updatedAt": "2026-01-01T00:01:00.000Z",
  "metadata": {
    "emittedBy": "ruleoak-py",
    "sdkVersion": "0.2.1",
    "compatibility": "core-v2.1"
  }
}
